t 0 /NodeList/2/$ns3::Ipv4L3Protocol/Tx(1) ns3::Ipv4Header (tos 0x0 DSCP Default ECN Not-ECT ttl 64 id 0 protocol 6 offset (bytes) 0 flags [none] length: 56 10.0.2.1 > 10.0.3.2) ns3::TcpHeader (49153 > 50000 [SYN] Seq=0 Ack=0 Win=32768 ns3::TcpOptionWinScale(2) ns3::TcpOptionTS(0;0) ns3::TcpOptionEnd(EOL))
r 0.0450464 /NodeList/0/$ns3::Ipv4L3Protocol/Rx(2) ns3::Ipv4Header (tos 0x0 DSCP Default ECN Not-ECT ttl 64 id 0 protocol 6 offset (bytes) 0 flags [none] length: 56 10.0.2.1 > 10.0.3.2) ns3::TcpHeader (49153 > 50000 [SYN] Seq=0 Ack=0 Win=32768 ns3::TcpOptionWinScale(2) ns3::TcpOptionTS(0;0) ns3::TcpOptionEnd(EOL))
t 0.0450464 /NodeList/0/$ns3::Ipv4L3Protocol/Tx(1) ns3::Ipv4Header (tos 0x0 DSCP Default ECN Not-ECT ttl 63 id 0 protocol 6 offset (bytes) 0 flags [none] length: 56 10.0.2.1 > 10.0.3.2) ns3::TcpHeader (49153 > 50000 [SYN] Seq=0 Ack=0 Win=32768 ns3::TcpOptionWinScale(2) ns3::TcpOptionTS(0;0) ns3::TcpOptionEnd(EOL))
r 0.0505104 /NodeList/1/$ns3::Ipv4L3Protocol/Rx(1) ns3::Ipv4Header (tos 0x0 DSCP Default ECN Not-ECT ttl 63 id 0 protocol 6 offset (bytes) 0 flags [none] length: 56 10.0.2.1 > 10.0.3.2) ns3::TcpHeader (49153 > 50000 [SYN] Seq=0 Ack=0 Win=32768 ns3::TcpOptionWinScale(2) ns3::TcpOptionTS(0;0) ns3::TcpOptionEnd(EOL))
t 0.0505104 /NodeList/1/$ns3::Ipv4L3Protocol/Tx(2) ns3::Ipv4Header (tos 0x0 DSCP Default ECN Not-ECT ttl 62 id 0 protocol 6 offset (bytes) 0 flags [none] length: 56 10.0.2.1 > 10.0.3.2) ns3::TcpHeader (49153 > 50000 [SYN] Seq=0 Ack=0 Win=32768 ns3::TcpOptionWinScale(2) ns3::TcpOptionTS(0;0) ns3::TcpOptionEnd(EOL))
r 0.0507524 /NodeList/3/$ns3::Ipv4L3Protocol/Rx(1) ns3::Ipv4Header (tos 0x0 DSCP Default ECN Not-ECT ttl 62 id 0 protocol 6 offset (bytes) 0 flags [none] length: 56 10.0.2.1 > 10.0.3.2) ns3::TcpHeader (49153 > 50000 [SYN] Seq=0 Ack=0 Win=32768 ns3::TcpOptionWinScale(2) ns3::TcpOptionTS(0;0) ns3::TcpOptionEnd(EOL))
t 0.0507524 /NodeList/3/$ns3::Ipv4L3Protocol/Tx(1) ns3::Ipv4Header (tos 0x0 DSCP Default ECN Not-ECT ttl 64 id 0 protocol 6 offset (bytes) 0 flags [none] length: 56 10.0.3.2 > 10.0.2.1) ns3::TcpHeader (50000 > 49153 [SYN|ACK] Seq=0 Ack=1 Win=32768 ns3::TcpOptionWinScale(2) ns3::TcpOptionTS(50;0) ns3::TcpOptionEnd(EOL))
r 0.0509944 /NodeList/1/$ns3::Ipv4L3Protocol/Rx(2) ns3::Ipv4Header (tos 0x0 DSCP Default ECN Not-ECT ttl 64 id 0 protocol 6 offset (bytes) 0 flags [none] length: 56 10.0.3.2 > 10.0.2.1) ns3::TcpHeader (50000 > 49153 [SYN|ACK] Seq=0 Ack=1 Win=32768 ns3::TcpOptionWinScale(2) ns3::TcpOptionTS(50;0) ns3::TcpOptionEnd(EOL))
t 0.0509944 /NodeList/1/$ns3::Ipv4L3Protocol/Tx(1) ns3::Ipv4Header (tos 0x0 DSCP Default ECN Not-ECT ttl 63 id 0 protocol 6 offset (bytes) 0 flags [none] length: 56 10.0.3.2 > 10.0.2.1) ns3::TcpHeader (50000 > 49153 [SYN|ACK] Seq=0 Ack=1 Win=32768 ns3::TcpOptionWinScale(2) ns3::TcpOptionTS(50;0) ns3::TcpOptionEnd(EOL))
r 0.0564584 /NodeList/0/$ns3::Ipv4L3Protocol/Rx(1) ns3::Ipv4Header (tos 0x0 DSCP Default ECN Not-ECT ttl 63 id 0 protocol 6 offset (bytes) 0 flags [none] length: 56 10.0.3.2 > 10.0.2.1) ns3::TcpHeader (50000 > 49153 [SYN|ACK] Seq=0 Ack=1 Win=32768 ns3::TcpOptionWinScale(2) ns3::TcpOptionTS(50;0) ns3::TcpOptionEnd(EOL))
t 0.0564584 /NodeList/0/$ns3::Ipv4L3Protocol/Tx(2) ns3::Ipv4Header (tos 0x0 DSCP Default ECN Not-ECT ttl 62 id 0 protocol 6 offset (bytes) 0 flags [none] length: 56 10.0.3.2 > 10.0.2.1) ns3::TcpHeader (50000 > 49153 [SYN|ACK] Seq=0 Ack=1 Win=32768 ns3::TcpOptionWinScale(2) ns3::TcpOptionTS(50;0) ns3::TcpOptionEnd(EOL))
r 0.101505 /NodeList/2/$ns3::Ipv4L3Protocol/Rx(1) ns3::Ipv4Header (tos 0x0 DSCP Default ECN Not-ECT ttl 62 id 0 protocol 6 offset (bytes) 0 flags [none] length: 56 10.0.3.2 > 10.0.2.1) ns3::TcpHeader (50000 > 49153 [SYN|ACK] Seq=0 Ack=1 Win=32768 ns3::TcpOptionWinScale(2) ns3::TcpOptionTS(50;0) ns3::TcpOptionEnd(EOL))
t 0.101505 /NodeList/2/$ns3::Ipv4L3Protocol/Tx(1) ns3::Ipv4Header (tos 0x0 DSCP Default ECN Not-ECT ttl 64 id 1 protocol 6 offset (bytes) 0 flags [none] length: 52 10.0.2.1 > 10.0.3.2) ns3::TcpHeader (49153 > 50000 [ACK] Seq=1 Ack=1 Win=32768 ns3::TcpOptionTS(101;50) ns3::TcpOptionEnd(EOL))
t 0.101505 /NodeList/2/$ns3::Ipv4L3Protocol/Tx(1) ns3::Ipv4Header (tos 0x0 DSCP Default ECN Not-ECT ttl 64 id 2 protocol 6 offset (bytes) 0 flags [none] length: 412 10.0.2.1 > 10.0.3.2) ns3::TcpHeader (49153 > 50000 [ACK] Seq=1 Ack=1 Win=32768 ns3::TcpOptionTS(101;50) ns3::TcpOptionEnd(EOL)) Payload (size=360)
r 0.146548 /NodeList/0/$ns3::Ipv4L3Protocol/Rx(2) ns3::Ipv4Header (tos 0x0 DSCP Default ECN Not-ECT ttl 64 id 1 protocol 6 offset (bytes) 0 flags [none] length: 52 10.0.2.1 > 10.0.3.2) ns3::TcpHeader (49153 > 50000 [ACK] Seq=1 Ack=1 Win=32768 ns3::TcpOptionTS(101;50) ns3::TcpOptionEnd(EOL))
t 0.146548 /NodeList/0/$ns3::Ipv4L3Protocol/Tx(1) ns3::Ipv4Header (tos 0x0 DSCP Default ECN Not-ECT ttl 63 id 1 protocol 6 offset (bytes) 0 flags [none] length: 52 10.0.2.1 > 10.0.3.2) ns3::TcpHeader (49153 > 50000 [ACK] Seq=1 Ack=1 Win=32768 ns3::TcpOptionTS(101;50) ns3::TcpOptionEnd(EOL))
r 0.146879 /NodeList/0/$ns3::Ipv4L3Protocol/Rx(2) ns3::Ipv4Header (tos 0x0 DSCP Default ECN Not-ECT ttl 64 id 2 protocol 6 offset (bytes) 0 flags [none] length: 412 10.0.2.1 > 10.0.3.2) ns3::TcpHeader (49153 > 50000 [ACK] Seq=1 Ack=1 Win=32768 ns3::TcpOptionTS(101;50) ns3::TcpOptionEnd(EOL)) Payload (size=360)
t 0.146879 /NodeList/0/$ns3::Ipv4L3Protocol/Tx(1) ns3::Ipv4Header (tos 0x0 DSCP Default ECN Not-ECT ttl 63 id 2 protocol 6 offset (bytes) 0 flags [none] length: 412 10.0.2.1 > 10.0.3.2) ns3::TcpHeader (49153 > 50000 [ACK] Seq=1 Ack=1 Win=32768 ns3::TcpOptionTS(101;50) ns3::TcpOptionEnd(EOL)) Payload (size=360)
r 0.15198 /NodeList/1/$ns3::Ipv4L3Protocol/Rx(1) ns3::Ipv4Header (tos 0x0 DSCP Default ECN Not-ECT ttl 63 id 1 protocol 6 offset (bytes) 0 flags [none] length: 52 10.0.2.1 > 10.0.3.2) ns3::TcpHeader (49153 > 50000 [ACK] Seq=1 Ack=1 Win=32768 ns3::TcpOptionTS(101;50) ns3::TcpOptionEnd(EOL))
t 0.15198 /NodeList/1/$ns3::Ipv4L3Protocol/Tx(2) ns3::Ipv4Header (tos 0x0 DSCP Default ECN Not-ECT ttl 62 id 1 protocol 6 offset (bytes) 0 flags [none] length: 52 10.0.2.1 > 10.0.3.2) ns3::TcpHeader (49153 > 50000 [ACK] Seq=1 Ack=1 Win=32768 ns3::TcpOptionTS(101;50) ns3::TcpOptionEnd(EOL))
r 0.152206 /NodeList/3/$ns3::Ipv4L3Protocol/Rx(1) ns3::Ipv4Header (tos 0x0 DSCP Default ECN Not-ECT ttl 62 id 1 protocol 6 offset (bytes) 0 flags [none] length: 52 10.0.2.1 > 10.0.3.2) ns3::TcpHeader (49153 > 50000 [ACK] Seq=1 Ack=1 Win=32768 ns3::TcpOptionTS(101;50) ns3::TcpOptionEnd(EOL))
r 0.155292 /NodeList/1/$ns3::Ipv4L3Protocol/Rx(1) ns3::Ipv4Header (tos 0x0 DSCP Default ECN Not-ECT ttl 63 id 2 protocol 6 offset (bytes) 0 flags [none] length: 412 10.0.2.1 > 10.0.3.2) ns3::TcpHeader (49153 > 50000 [ACK] Seq=1 Ack=1 Win=32768 ns3::TcpOptionTS(101;50) ns3::TcpOptionEnd(EOL)) Payload (size=360)
t 0.155292 /NodeList/1/$ns3::Ipv4L3Protocol/Tx(2) ns3::Ipv4Header (tos 0x0 DSCP Default ECN Not-ECT ttl 62 id 2 protocol 6 offset (bytes) 0 flags [none] length: 412 10.0.2.1 > 10.0.3.2) ns3::TcpHeader (49153 > 50000 [ACK] Seq=1 Ack=1 Win=32768 ns3::TcpOptionTS(101;50) ns3::TcpOptionEnd(EOL)) Payload (size=360)
r 0.156958 /NodeList/3/$ns3::Ipv4L3Protocol/Rx(1) ns3::Ipv4Header (tos 0x0 DSCP Default ECN Not-ECT ttl 62 id 2 protocol 6 offset (bytes) 0 flags [none] length: 412 10.0.2.1 > 10.0.3.2) ns3::TcpHeader (49153 > 50000 [ACK] Seq=1 Ack=1 Win=32768 ns3::TcpOptionTS(101;50) ns3::TcpOptionEnd(EOL)) Payload (size=360)
t 0.156958 /NodeList/3/$ns3::Ipv4L3Protocol/Tx(1) ns3::Ipv4Header (tos 0x0 DSCP Default ECN Not-ECT ttl 64 id 1 protocol 6 offset (bytes) 0 flags [none] length: 52 10.0.3.2 > 10.0.2.1) ns3::TcpHeader (50000 > 49153 [ACK] Seq=1 Ack=361 Win=32678 ns3::TcpOptionTS(156;101) ns3::TcpOptionEnd(EOL))
r 0.157184 /NodeList/1/$ns3::Ipv4L3Protocol/Rx(2) ns3::Ipv4Header (tos 0x0 DSCP Default ECN Not-ECT ttl 64 id 1 protocol 6 offset (bytes) 0 flags [none] length: 52 10.0.3.2 > 10.0.2.1) ns3::TcpHeader (50000 > 49153 [ACK] Seq=1 Ack=361 Win=32678 ns3::TcpOptionTS(156;101) ns3::TcpOptionEnd(EOL))
t 0.157184 /NodeList/1/$ns3::Ipv4L3Protocol/Tx(1) ns3::Ipv4Header (tos 0x0 DSCP Default ECN Not-ECT ttl 63 id 1 protocol 6 offset (bytes) 0 flags [none] length: 52 10.0.3.2 > 10.0.2.1) ns3::TcpHeader (50000 > 49153 [ACK] Seq=1 Ack=361 Win=32678 ns3::TcpOptionTS(156;101) ns3::TcpOptionEnd(EOL))
r 0.162616 /NodeList/0/$ns3::Ipv4L3Protocol/Rx(1) ns3::Ipv4Header (tos 0x0 DSCP Default ECN Not-ECT ttl 63 id 1 protocol 6 offset (bytes) 0 flags [none] length: 52 10.0.3.2 > 10.0.2.1) ns3::TcpHeader (50000 > 49153 [ACK] Seq=1 Ack=361 Win=32678 ns3::TcpOptionTS(156;101) ns3::TcpOptionEnd(EOL))
t 0.162616 /NodeList/0/$ns3::Ipv4L3Protocol/Tx(2) ns3::Ipv4Header (tos 0x0 DSCP Default ECN Not-ECT ttl 62 id 1 protocol 6 offset (bytes) 0 flags [none] length: 52 10.0.3.2 > 10.0.2.1) ns3::TcpHeader (50000 > 49153 [ACK] Seq=1 Ack=361 Win=32678 ns3::TcpOptionTS(156;101) ns3::TcpOptionEnd(EOL))
r 0.207659 /NodeList/2/$ns3::Ipv4L3Protocol/Rx(1) ns3::Ipv4Header (tos 0x0 DSCP Default ECN Not-ECT ttl 62 id 1 protocol 6 offset (bytes) 0 flags [none] length: 52 10.0.3.2 > 10.0.2.1) ns3::TcpHeader (50000 > 49153 [ACK] Seq=1 Ack=361 Win=32678 ns3::TcpOptionTS(156;101) ns3::TcpOptionEnd(EOL))
t 0.207659 /NodeList/2/$ns3::Ipv4L3Protocol/Tx(1) ns3::Ipv4Header (tos 0x0 DSCP Default ECN Not-ECT ttl 64 id 3 protocol 6 offset (bytes) 0 flags [none] length: 412 10.0.2.1 > 10.0.3.2) ns3::TcpHeader (49153 > 50000 [ACK] Seq=361 Ack=1 Win=32768 ns3::TcpOptionTS(207;156) ns3::TcpOptionEnd(EOL)) Payload (size=360)
t 0.207659 /NodeList/2/$ns3::Ipv4L3Protocol/Tx(1) ns3::Ipv4Header (tos 0x0 DSCP Default ECN Not-ECT ttl 64 id 4 protocol 6 offset (bytes) 0 flags [none] length: 412 10.0.2.1 > 10.0.3.2) ns3::TcpHeader (49153 > 50000 [ACK] Seq=721 Ack=1 Win=32768 ns3::TcpOptionTS(207;156) ns3::TcpOptionEnd(EOL)) Payload (size=360)
r 0.25299 /NodeList/0/$ns3::Ipv4L3Protocol/Rx(2) ns3::Ipv4Header (tos 0x0 DSCP Default ECN Not-ECT ttl 64 id 3 protocol 6 offset (bytes) 0 flags [none] length: 412 10.0.2.1 > 10.0.3.2) ns3::TcpHeader (49153 > 50000 [ACK] Seq=361 Ack=1 Win=32768 ns3::TcpOptionTS(207;156) ns3::TcpOptionEnd(EOL)) Payload (size=360)
t 0.25299 /NodeList/0/$ns3::Ipv4L3Protocol/Tx(1) ns3::Ipv4Header (tos 0x0 DSCP Default ECN Not-ECT ttl 63 id 3 protocol 6 offset (bytes) 0 flags [none] length: 412 10.0.2.1 > 10.0.3.2) ns3::TcpHeader (49153 > 50000 [ACK] Seq=361 Ack=1 Win=32768 ns3::TcpOptionTS(207;156) ns3::TcpOptionEnd(EOL)) Payload (size=360)
r 0.253322 /NodeList/0/$ns3::Ipv4L3Protocol/Rx(2) ns3::Ipv4Header (tos 0x0 DSCP Default ECN Not-ECT ttl 64 id 4 protocol 6 offset (bytes) 0 flags [none] length: 412 10.0.2.1 > 10.0.3.2) ns3::TcpHeader (49153 > 50000 [ACK] Seq=721 Ack=1 Win=32768 ns3::TcpOptionTS(207;156) ns3::TcpOptionEnd(EOL)) Payload (size=360)
t 0.253322 /NodeList/0/$ns3::Ipv4L3Protocol/Tx(1) ns3::Ipv4Header (tos 0x0 DSCP Default ECN Not-ECT ttl 63 id 4 protocol 6 offset (bytes) 0 flags [none] length: 412 10.0.2.1 > 10.0.3.2) ns3::TcpHeader (49153 > 50000 [ACK] Seq=721 Ack=1 Win=32768 ns3::TcpOptionTS(207;156) ns3::TcpOptionEnd(EOL)) Payload (size=360)
r 0.261302 /NodeList/1/$ns3::Ipv4L3Protocol/Rx(1) ns3::Ipv4Header (tos 0x0 DSCP Default ECN Not-ECT ttl 63 id 3 protocol 6 offset (bytes) 0 flags [none] length: 412 10.0.2.1 > 10.0.3.2) ns3::TcpHeader (49153 > 50000 [ACK] Seq=361 Ack=1 Win=32768 ns3::TcpOptionTS(207;156) ns3::TcpOptionEnd(EOL)) Payload (size=360)
t 0.261302 /NodeList/1/$ns3::Ipv4L3Protocol/Tx(2) ns3::Ipv4Header (tos 0x0 DSCP Default ECN Not-ECT ttl 62 id 3 protocol 6 offset (bytes) 0 flags [none] length: 412 10.0.2.1 > 10.0.3.2) ns3::TcpHeader (49153 > 50000 [ACK] Seq=361 Ack=1 Win=32768 ns3::TcpOptionTS(207;156) ns3::TcpOptionEnd(EOL)) Payload (size=360)
r 0.262968 /NodeList/3/$ns3::Ipv4L3Protocol/Rx(1) ns3::Ipv4Header (tos 0x0 DSCP Default ECN Not-ECT ttl 62 id 3 protocol 6 offset (bytes) 0 flags [none] length: 412 10.0.2.1 > 10.0.3.2) ns3::TcpHeader (49153 > 50000 [ACK] Seq=361 Ack=1 Win=32768 ns3::TcpOptionTS(207;156) ns3::TcpOptionEnd(EOL)) Payload (size=360)
r 0.264614 /NodeList/1/$ns3::Ipv4L3Protocol/Rx(1) ns3::Ipv4Header (tos 0x0 DSCP Default ECN Not-ECT ttl 63 id 4 protocol 6 offset (bytes) 0 flags [none] length: 412 10.0.2.1 > 10.0.3.2) ns3::TcpHeader (49153 > 50000 [ACK] Seq=721 Ack=1 Win=32768 ns3::TcpOptionTS(207;156) ns3::TcpOptionEnd(EOL)) Payload (size=360)
t 0.264614 /NodeList/1/$ns3::Ipv4L3Protocol/Tx(2) ns3::Ipv4Header (tos 0x0 DSCP Default ECN Not-ECT ttl 62 id 4 protocol 6 offset (bytes) 0 flags [none] length: 412 10.0.2.1 > 10.0.3.2) ns3::TcpHeader (49153 > 50000 [ACK] Seq=721 Ack=1 Win=32768 ns3::TcpOptionTS(207;156) ns3::TcpOptionEnd(EOL)) Payload (size=360)
r 0.26628 /NodeList/3/$ns3::Ipv4L3Protocol/Rx(1) ns3::Ipv4Header (tos 0x0 DSCP Default ECN Not-ECT ttl 62 id 4 protocol 6 offset (bytes) 0 flags [none] length: 412 10.0.2.1 > 10.0.3.2) ns3::TcpHeader (49153 > 50000 [ACK] Seq=721 Ack=1 Win=32768 ns3::TcpOptionTS(207;156) ns3::TcpOptionEnd(EOL)) Payload (size=360)
t 0.26628 /NodeList/3/$ns3::Ipv4L3Protocol/Tx(1) ns3::Ipv4Header (tos 0x0 DSCP Default ECN Not-ECT ttl 64 id 2 protocol 6 offset (bytes) 0 flags [none] length: 52 10.0.3.2 > 10.0.2.1) ns3::TcpHeader (50000 > 49153 [ACK] Seq=1 Ack=1081 Win=32678 ns3::TcpOptionTS(266;207) ns3::TcpOptionEnd(EOL))
r 0.266506 /NodeList/1/$ns3::Ipv4L3Protocol/Rx(2) ns3::Ipv4Header (tos 0x0 DSCP Default ECN Not-ECT ttl 64 id 2 protocol 6 offset (bytes) 0 flags [none] length: 52 10.0.3.2 > 10.0.2.1) ns3::TcpHeader (50000 > 49153 [ACK] Seq=1 Ack=1081 Win=32678 ns3::TcpOptionTS(266;207) ns3::TcpOptionEnd(EOL))
t 0.266506 /NodeList/1/$ns3::Ipv4L3Protocol/Tx(1) ns3::Ipv4Header (tos 0x0 DSCP Default ECN Not-ECT ttl 63 id 2 protocol 6 offset (bytes) 0 flags [none] length: 52 10.0.3.2 > 10.0.2.1) ns3::TcpHeader (50000 > 49153 [ACK] Seq=1 Ack=1081 Win=32678 ns3::TcpOptionTS(266;207) ns3::TcpOptionEnd(EOL))
r 0.271938 /NodeList/0/$ns3::Ipv4L3Protocol/Rx(1) ns3::Ipv4Header (tos 0x0 DSCP Default ECN Not-ECT ttl 63 id 2 protocol 6 offset (bytes) 0 flags [none] length: 52 10.0.3.2 > 10.0.2.1) ns3::TcpHeader (50000 > 49153 [ACK] Seq=1 Ack=1081 Win=32678 ns3::TcpOptionTS(266;207) ns3::TcpOptionEnd(EOL))
t 0.271938 /NodeList/0/$ns3::Ipv4L3Protocol/Tx(2) ns3::Ipv4Header (tos 0x0 DSCP Default ECN Not-ECT ttl 62 id 2 protocol 6 offset (bytes) 0 flags [none] length: 52 10.0.3.2 > 10.0.2.1) ns3::TcpHeader (50000 > 49153 [ACK] Seq=1 Ack=1081 Win=32678 ns3::TcpOptionTS(266;207) ns3::TcpOptionEnd(EOL))
r 0.316982 /NodeList/2/$ns3::Ipv4L3Protocol/Rx(1) ns3::Ipv4Header (tos 0x0 DSCP Default ECN Not-ECT ttl 62 id 2 protocol 6 offset (bytes) 0 flags [none] length: 52 10.0.3.2 > 10.0.2.1) ns3::TcpHeader (50000 > 49153 [ACK] Seq=1 Ack=1081 Win=32678 ns3::TcpOptionTS(266;207) ns3::TcpOptionEnd(EOL))
t 0.316982 /NodeList/2/$ns3::Ipv4L3Protocol/Tx(1) ns3::Ipv4Header (tos 0x0 DSCP Default ECN Not-ECT ttl 64 id 5 protocol 6 offset (bytes) 0 flags [none] length: 412 10.0.2.1 > 10.0.3.2) ns3::TcpHeader (49153 > 50000 [ACK] Seq=1081 Ack=1 Win=32768 ns3::TcpOptionTS(316;266) ns3::TcpOptionEnd(EOL)) Payload (size=360)
t 0.316982 /NodeList/2/$ns3::Ipv4L3Protocol/Tx(1) ns3::Ipv4Header (tos 0x0 DSCP Default ECN Not-ECT ttl 64 id 6 protocol 6 offset (bytes) 0 flags [none] length: 412 10.0.2.1 > 10.0.3.2) ns3::TcpHeader (49153 > 50000 [ACK] Seq=1441 Ack=1 Win=32768 ns3::TcpOptionTS(316;266) ns3::TcpOptionEnd(EOL)) Payload (size=360)
t 0.316982 /NodeList/2/$ns3::Ipv4L3Protocol/Tx(1) ns3::Ipv4Header (tos 0x0 DSCP Default ECN Not-ECT ttl 64 id 7 protocol 6 offset (bytes) 0 flags [none] length: 412 10.0.2.1 > 10.0.3.2) ns3::TcpHeader (49153 > 50000 [ACK] Seq=1801 Ack=1 Win=32768 ns3::TcpOptionTS(316;266) ns3::TcpOptionEnd(EOL)) Payload (size=360)
r 0.362313 /NodeList/0/$ns3::Ipv4L3Protocol/Rx(2) ns3::Ipv4Header (tos 0x0 DSCP Default ECN Not-ECT ttl 64 id 5 protocol 6 offset (bytes) 0 flags [none] length: 412 10.0.2.1 > 10.0.3.2) ns3::TcpHeader (49153 > 50000 [ACK] Seq=1081 Ack=1 Win=32768 ns3::TcpOptionTS(316;266) ns3::TcpOptionEnd(EOL)) Payload (size=360)
t 0.362313 /NodeList/0/$ns3::Ipv4L3Protocol/Tx(1) ns3::Ipv4Header (tos 0x0 DSCP Default ECN Not-ECT ttl 63 id 5 protocol 6 offset (bytes) 0 flags [none] length: 412 10.0.2.1 > 10.0.3.2) ns3::TcpHeader (49153 > 50000 [ACK] Seq=1081 Ack=1 Win=32768 ns3::TcpOptionTS(316;266) ns3::TcpOptionEnd(EOL)) Payload (size=360)
r 0.362644 /NodeList/0/$ns3::Ipv4L3Protocol/Rx(2) ns3::Ipv4Header (tos 0x0 DSCP Default ECN Not-ECT ttl 64 id 6 protocol 6 offset (bytes) 0 flags [none] length: 412 10.0.2.1 > 10.0.3.2) ns3::TcpHeader (49153 > 50000 [ACK] Seq=1441 Ack=1 Win=32768 ns3::TcpOptionTS(316;266) ns3::TcpOptionEnd(EOL)) Payload (size=360)
t 0.362644 /NodeList/0/$ns3::Ipv4L3Protocol/Tx(1) ns3::Ipv4Header (tos 0x0 DSCP Default ECN Not-ECT ttl 63 id 6 protocol 6 offset (bytes) 0 flags [none] length: 412 10.0.2.1 > 10.0.3.2) ns3::TcpHeader (49153 > 50000 [ACK] Seq=1441 Ack=1 Win=32768 ns3::TcpOptionTS(316;266) ns3::TcpOptionEnd(EOL)) Payload (size=360)
r 0.362975 /NodeList/0/$ns3::Ipv4L3Protocol/Rx(2) ns3::Ipv4Header (tos 0x0 DSCP Default ECN Not-ECT ttl 64 id 7 protocol 6 offset (bytes) 0 flags [none] length: 412 10.0.2.1 > 10.0.3.2) ns3::TcpHeader (49153 > 50000 [ACK] Seq=1801 Ack=1 Win=32768 ns3::TcpOptionTS(316;266) ns3::TcpOptionEnd(EOL)) Payload (size=360)
t 0.362975 /NodeList/0/$ns3::Ipv4L3Protocol/Tx(1) ns3::Ipv4Header (tos 0x0 DSCP Default ECN Not-ECT ttl 63 id 7 protocol 6 offset (bytes) 0 flags [none] length: 412 10.0.2.1 > 10.0.3.2) ns3::TcpHeader (49153 > 50000 [ACK] Seq=1801 Ack=1 Win=32768 ns3::TcpOptionTS(316;266) ns3::TcpOptionEnd(EOL)) Payload (size=360)
r 0.370625 /NodeList/1/$ns3::Ipv4L3Protocol/Rx(1) ns3::Ipv4Header (tos 0x0 DSCP Default ECN Not-ECT ttl 63 id 5 protocol 6 offset (bytes) 0 flags [none] length: 412 10.0.2.1 > 10.0.3.2) ns3::TcpHeader (49153 > 50000 [ACK] Seq=1081 Ack=1 Win=32768 ns3::TcpOptionTS(316;266) ns3::TcpOptionEnd(EOL)) Payload (size=360)
t 0.370625 /NodeList/1/$ns3::Ipv4L3Protocol/Tx(2) ns3::Ipv4Header (tos 0x0 DSCP Default ECN Not-ECT ttl 62 id 5 protocol 6 offset (bytes) 0 flags [none] length: 412 10.0.2.1 > 10.0.3.2) ns3::TcpHeader (49153 > 50000 [ACK] Seq=1081 Ack=1 Win=32768 ns3::TcpOptionTS(316;266) ns3::TcpOptionEnd(EOL)) Payload (size=360)
r 0.372291 /NodeList/3/$ns3::Ipv4L3Protocol/Rx(1) ns3::Ipv4Header (tos 0x0 DSCP Default ECN Not-ECT ttl 62 id 5 protocol 6 offset (bytes) 0 flags [none] length: 412 10.0.2.1 > 10.0.3.2) ns3::TcpHeader (49153 > 50000 [ACK] Seq=1081 Ack=1 Win=32768 ns3::TcpOptionTS(316;266) ns3::TcpOptionEnd(EOL)) Payload (size=360)
r 0.373937 /NodeList/1/$ns3::Ipv4L3Protocol/Rx(1) ns3::Ipv4Header (tos 0x0 DSCP Default ECN Not-ECT ttl 63 id 6 protocol 6 offset (bytes) 0 flags [none] length: 412 10.0.2.1 > 10.0.3.2) ns3::TcpHeader (49153 > 50000 [ACK] Seq=1441 Ack=1 Win=32768 ns3::TcpOptionTS(316;266) ns3::TcpOptionEnd(EOL)) Payload (size=360)
t 0.373937 /NodeList/1/$ns3::Ipv4L3Protocol/Tx(2) ns3::Ipv4Header (tos 0x0 DSCP Default ECN Not-ECT ttl 62 id 6 protocol 6 offset (bytes) 0 flags [none] length: 412 10.0.2.1 > 10.0.3.2) ns3::TcpHeader (49153 > 50000 [ACK] Seq=1441 Ack=1 Win=32768 ns3::TcpOptionTS(316;266) ns3::TcpOptionEnd(EOL)) Payload (size=360)
r 0.375603 /NodeList/3/$ns3::Ipv4L3Protocol/Rx(1) ns3::Ipv4Header (tos 0x0 DSCP Default ECN Not-ECT ttl 62 id 6 protocol 6 offset (bytes) 0 flags [none] length: 412 10.0.2.1 > 10.0.3.2) ns3::TcpHeader (49153 > 50000 [ACK] Seq=1441 Ack=1 Win=32768 ns3::TcpOptionTS(316;266) ns3::TcpOptionEnd(EOL)) Payload (size=360)
t 0.375603 /NodeList/3/$ns3::Ipv4L3Protocol/Tx(1) ns3::Ipv4Header (tos 0x0 DSCP Default ECN Not-ECT ttl 64 id 3 protocol 6 offset (bytes) 0 flags [none] length: 52 10.0.3.2 > 10.0.2.1) ns3::TcpHeader (50000 > 49153 [ACK] Seq=1 Ack=1801 Win=32678 ns3::TcpOptionTS(375;316) ns3::TcpOptionEnd(EOL))
r 0.375829 /NodeList/1/$ns3::Ipv4L3Protocol/Rx(2) ns3::Ipv4Header (tos 0x0 DSCP Default ECN Not-ECT ttl 64 id 3 protocol 6 offset (bytes) 0 flags [none] length: 52 10.0.3.2 > 10.0.2.1) ns3::TcpHeader (50000 > 49153 [ACK] Seq=1 Ack=1801 Win=32678 ns3::TcpOptionTS(375;316) ns3::TcpOptionEnd(EOL))
t 0.375829 /NodeList/1/$ns3::Ipv4L3Protocol/Tx(1) ns3::Ipv4Header (tos 0x0 DSCP Default ECN Not-ECT ttl 63 id 3 protocol 6 offset (bytes) 0 flags [none] length: 52 10.0.3.2 > 10.0.2.1) ns3::TcpHeader (50000 > 49153 [ACK] Seq=1 Ack=1801 Win=32678 ns3::TcpOptionTS(375;316) ns3::TcpOptionEnd(EOL))
r 0.377249 /NodeList/1/$ns3::Ipv4L3Protocol/Rx(1) ns3::Ipv4Header (tos 0x0 DSCP Default ECN Not-ECT ttl 63 id 7 protocol 6 offset (bytes) 0 flags [none] length: 412 10.0.2.1 > 10.0.3.2) ns3::TcpHeader (49153 > 50000 [ACK] Seq=1801 Ack=1 Win=32768 ns3::TcpOptionTS(316;266) ns3::TcpOptionEnd(EOL)) Payload (size=360)
t 0.377249 /NodeList/1/$ns3::Ipv4L3Protocol/Tx(2) ns3::Ipv4Header (tos 0x0 DSCP Default ECN Not-ECT ttl 62 id 7 protocol 6 offset (bytes) 0 flags [none] length: 412 10.0.2.1 > 10.0.3.2) ns3::TcpHeader (49153 > 50000 [ACK] Seq=1801 Ack=1 Win=32768 ns3::TcpOptionTS(316;266) ns3::TcpOptionEnd(EOL)) Payload (size=360)
r 0.378915 /NodeList/3/$ns3::Ipv4L3Protocol/Rx(1) ns3::Ipv4Header (tos 0x0 DSCP Default ECN Not-ECT ttl 62 id 7 protocol 6 offset (bytes) 0 flags [none] length: 412 10.0.2.1 > 10.0.3.2) ns3::TcpHeader (49153 > 50000 [ACK] Seq=1801 Ack=1 Win=32768 ns3::TcpOptionTS(316;266) ns3::TcpOptionEnd(EOL)) Payload (size=360)
r 0.381261 /NodeList/0/$ns3::Ipv4L3Protocol/Rx(1) ns3::Ipv4Header (tos 0x0 DSCP Default ECN Not-ECT ttl 63 id 3 protocol 6 offset (bytes) 0 flags [none] length: 52 10.0.3.2 > 10.0.2.1) ns3::TcpHeader (50000 > 49153 [ACK] Seq=1 Ack=1801 Win=32678 ns3::TcpOptionTS(375;316) ns3::TcpOptionEnd(EOL))
t 0.381261 /NodeList/0/$ns3::Ipv4L3Protocol/Tx(2) ns3::Ipv4Header (tos 0x0 DSCP Default ECN Not-ECT ttl 62 id 3 protocol 6 offset (bytes) 0 flags [none] length: 52 10.0.3.2 > 10.0.2.1) ns3::TcpHeader (50000 > 49153 [ACK] Seq=1 Ack=1801 Win=32678 ns3::TcpOptionTS(375;316) ns3::TcpOptionEnd(EOL))
r 0.426304 /NodeList/2/$ns3::Ipv4L3Protocol/Rx(1) ns3::Ipv4Header (tos 0x0 DSCP Default ECN Not-ECT ttl 62 id 3 protocol 6 offset (bytes) 0 flags [none] length: 52 10.0.3.2 > 10.0.2.1) ns3::TcpHeader (50000 > 49153 [ACK] Seq=1 Ack=1801 Win=32678 ns3::TcpOptionTS(375;316) ns3::TcpOptionEnd(EOL))
t 0.426304 /NodeList/2/$ns3::Ipv4L3Protocol/Tx(1) ns3::Ipv4Header (tos 0x0 DSCP Default ECN Not-ECT ttl 64 id 8 protocol 6 offset (bytes) 0 flags [none] length: 412 10.0.2.1 > 10.0.3.2) ns3::TcpHeader (49153 > 50000 [ACK] Seq=2161 Ack=1 Win=32768 ns3::TcpOptionTS(426;375) ns3::TcpOptionEnd(EOL)) Payload (size=360)
t 0.426304 /NodeList/2/$ns3::Ipv4L3Protocol/Tx(1) ns3::Ipv4Header (tos 0x0 DSCP Default ECN Not-ECT ttl 64 id 9 protocol 6 offset (bytes) 0 flags [none] length: 412 10.0.2.1 > 10.0.3.2) ns3::TcpHeader (49153 > 50000 [ACK] Seq=2521 Ack=1 Win=32768 ns3::TcpOptionTS(426;375) ns3::TcpOptionEnd(EOL)) Payload (size=360)
t 0.426304 /NodeList/2/$ns3::Ipv4L3Protocol/Tx(1) ns3::Ipv4Header (tos 0x0 DSCP Default ECN Not-ECT ttl 64 id 10 protocol 6 offset (bytes) 0 flags [none] length: 412 10.0.2.1 > 10.0.3.2) ns3::TcpHeader (49153 > 50000 [ACK] Seq=2881 Ack=1 Win=32768 ns3::TcpOptionTS(426;375) ns3::TcpOptionEnd(EOL)) Payload (size=360)
r 0.471635 /NodeList/0/$ns3::Ipv4L3Protocol/Rx(2) ns3::Ipv4Header (tos 0x0 DSCP Default ECN Not-ECT ttl 64 id 8 protocol 6 offset (bytes) 0 flags [none] length: 412 10.0.2.1 > 10.0.3.2) ns3::TcpHeader (49153 > 50000 [ACK] Seq=2161 Ack=1 Win=32768 ns3::TcpOptionTS(426;375) ns3::TcpOptionEnd(EOL)) Payload (size=360)
t 0.471635 /NodeList/0/$ns3::Ipv4L3Protocol/Tx(1) ns3::Ipv4Header (tos 0x0 DSCP Default ECN Not-ECT ttl 63 id 8 protocol 6 offset (bytes) 0 flags [none] length: 412 10.0.2.1 > 10.0.3.2) ns3::TcpHeader (49153 > 50000 [ACK] Seq=2161 Ack=1 Win=32768 ns3::TcpOptionTS(426;375) ns3::TcpOptionEnd(EOL)) Payload (size=360)
r 0.471966 /NodeList/0/$ns3::Ipv4L3Protocol/Rx(2) ns3::Ipv4Header (tos 0x0 DSCP Default ECN Not-ECT ttl 64 id 9 protocol 6 offset (bytes) 0 flags [none] length: 412 10.0.2.1 > 10.0.3.2) ns3::TcpHeader (49153 > 50000 [ACK] Seq=2521 Ack=1 Win=32768 ns3::TcpOptionTS(426;375) ns3::TcpOptionEnd(EOL)) Payload (size=360)
t 0.471966 /NodeList/0/$ns3::Ipv4L3Protocol/Tx(1) ns3::Ipv4Header (tos 0x0 DSCP Default ECN Not-ECT ttl 63 id 9 protocol 6 offset (bytes) 0 flags [none] length: 412 10.0.2.1 > 10.0.3.2) ns3::TcpHeader (49153 > 50000 [ACK] Seq=2521 Ack=1 Win=32768 ns3::TcpOptionTS(426;375) ns3::TcpOptionEnd(EOL)) Payload (size=360)
r 0.472298 /NodeList/0/$ns3::Ipv4L3Protocol/Rx(2) ns3::Ipv4Header (tos 0x0 DSCP Default ECN Not-ECT ttl 64 id 10 protocol 6 offset (bytes) 0 flags [none] length: 412 10.0.2.1 > 10.0.3.2) ns3::TcpHeader (49153 > 50000 [ACK] Seq=2881 Ack=1 Win=32768 ns3::TcpOptionTS(426;375) ns3::TcpOptionEnd(EOL)) Payload (size=360)
t 0.472298 /NodeList/0/$ns3::Ipv4L3Protocol/Tx(1) ns3::Ipv4Header (tos 0x0 DSCP Default ECN Not-ECT ttl 63 id 10 protocol 6 offset (bytes) 0 flags [none] length: 412 10.0.2.1 > 10.0.3.2) ns3::TcpHeader (49153 > 50000 [ACK] Seq=2881 Ack=1 Win=32768 ns3::TcpOptionTS(426;375) ns3::TcpOptionEnd(EOL)) Payload (size=360)
r 0.479947 /NodeList/1/$ns3::Ipv4L3Protocol/Rx(1) ns3::Ipv4Header (tos 0x0 DSCP Default ECN Not-ECT ttl 63 id 8 protocol 6 offset (bytes) 0 flags [none] length: 412 10.0.2.1 > 10.0.3.2) ns3::TcpHeader (49153 > 50000 [ACK] Seq=2161 Ack=1 Win=32768 ns3::TcpOptionTS(426;375) ns3::TcpOptionEnd(EOL)) Payload (size=360)
t 0.479947 /NodeList/1/$ns3::Ipv4L3Protocol/Tx(2) ns3::Ipv4Header (tos 0x0 DSCP Default ECN Not-ECT ttl 62 id 8 protocol 6 offset (bytes) 0 flags [none] length: 412 10.0.2.1 > 10.0.3.2) ns3::TcpHeader (49153 > 50000 [ACK] Seq=2161 Ack=1 Win=32768 ns3::TcpOptionTS(426;375) ns3::TcpOptionEnd(EOL)) Payload (size=360)
r 0.481613 /NodeList/3/$ns3::Ipv4L3Protocol/Rx(1) ns3::Ipv4Header (tos 0x0 DSCP Default ECN Not-ECT ttl 62 id 8 protocol 6 offset (bytes) 0 flags [none] length: 412 10.0.2.1 > 10.0.3.2) ns3::TcpHeader (49153 > 50000 [ACK] Seq=2161 Ack=1 Win=32768 ns3::TcpOptionTS(426;375) ns3::TcpOptionEnd(EOL)) Payload (size=360)
t 0.481613 /NodeList/3/$ns3::Ipv4L3Protocol/Tx(1) ns3::Ipv4Header (tos 0x0 DSCP Default ECN Not-ECT ttl 64 id 4 protocol 6 offset (bytes) 0 flags [none] length: 52 10.0.3.2 > 10.0.2.1) ns3::TcpHeader (50000 > 49153 [ACK] Seq=1 Ack=2521 Win=32678 ns3::TcpOptionTS(481;426) ns3::TcpOptionEnd(EOL))
r 0.481839 /NodeList/1/$ns3::Ipv4L3Protocol/Rx(2) ns3::Ipv4Header (tos 0x0 DSCP Default ECN Not-ECT ttl 64 id 4 protocol 6 offset (bytes) 0 flags [none] length: 52 10.0.3.2 > 10.0.2.1) ns3::TcpHeader (50000 > 49153 [ACK] Seq=1 Ack=2521 Win=32678 ns3::TcpOptionTS(481;426) ns3::TcpOptionEnd(EOL))
t 0.481839 /NodeList/1/$ns3::Ipv4L3Protocol/Tx(1) ns3::Ipv4Header (tos 0x0 DSCP Default ECN Not-ECT ttl 63 id 4 protocol 6 offset (bytes) 0 flags [none] length: 52 10.0.3.2 > 10.0.2.1) ns3::TcpHeader (50000 > 49153 [ACK] Seq=1 Ack=2521 Win=32678 ns3::TcpOptionTS(481;426) ns3::TcpOptionEnd(EOL))
r 0.483259 /NodeList/1/$ns3::Ipv4L3Protocol/Rx(1) ns3::Ipv4Header (tos 0x0 DSCP Default ECN Not-ECT ttl 63 id 9 protocol 6 offset (bytes) 0 flags [none] length: 412 10.0.2.1 > 10.0.3.2) ns3::TcpHeader (49153 > 50000 [ACK] Seq=2521 Ack=1 Win=32768 ns3::TcpOptionTS(426;375) ns3::TcpOptionEnd(EOL)) Payload (size=360)
t 0.483259 /NodeList/1/$ns3::Ipv4L3Protocol/Tx(2) ns3::Ipv4Header (tos 0x0 DSCP Default ECN Not-ECT ttl 62 id 9 protocol 6 offset (bytes) 0 flags [none] length: 412 10.0.2.1 > 10.0.3.2) ns3::TcpHeader (49153 > 50000 [ACK] Seq=2521 Ack=1 Win=32768 ns3::TcpOptionTS(426;375) ns3::TcpOptionEnd(EOL)) Payload (size=360)
r 0.484925 /NodeList/3/$ns3::Ipv4L3Protocol/Rx(1) ns3::Ipv4Header (tos 0x0 DSCP Default ECN Not-ECT ttl 62 id 9 protocol 6 offset (bytes) 0 flags [none] length: 412 10.0.2.1 > 10.0.3.2) ns3::TcpHeader (49153 > 50000 [ACK] Seq=2521 Ack=1 Win=32768 ns3::TcpOptionTS(426;375) ns3::TcpOptionEnd(EOL)) Payload (size=360)
r 0.486571 /NodeList/1/$ns3::Ipv4L3Protocol/Rx(1) ns3::Ipv4Header (tos 0x0 DSCP Default ECN Not-ECT ttl 63 id 10 protocol 6 offset (bytes) 0 flags [none] length: 412 10.0.2.1 > 10.0.3.2) ns3::TcpHeader (49153 > 50000 [ACK] Seq=2881 Ack=1 Win=32768 ns3::TcpOptionTS(426;375) ns3::TcpOptionEnd(EOL)) Payload (size=360)
t 0.486571 /NodeList/1/$ns3::Ipv4L3Protocol/Tx(2) ns3::Ipv4Header (tos 0x0 DSCP Default ECN Not-ECT ttl 62 id 10 protocol 6 offset (bytes) 0 flags [none] length: 412 10.0.2.1 > 10.0.3.2) ns3::TcpHeader (49153 > 50000 [ACK] Seq=2881 Ack=1 Win=32768 ns3::TcpOptionTS(426;375) ns3::TcpOptionEnd(EOL)) Payload (size=360)
r 0.487271 /NodeList/0/$ns3::Ipv4L3Protocol/Rx(1) ns3::Ipv4Header (tos 0x0 DSCP Default ECN Not-ECT ttl 63 id 4 protocol 6 offset (bytes) 0 flags [none] length: 52 10.0.3.2 > 10.0.2.1) ns3::TcpHeader (50000 > 49153 [ACK] Seq=1 Ack=2521 Win=32678 ns3::TcpOptionTS(481;426) ns3::TcpOptionEnd(EOL))
t 0.487271 /NodeList/0/$ns3::Ipv4L3Protocol/Tx(2) ns3::Ipv4Header (tos 0x0 DSCP Default ECN Not-ECT ttl 62 id 4 protocol 6 offset (bytes) 0 flags [none] length: 52 10.0.3.2 > 10.0.2.1) ns3::TcpHeader (50000 > 49153 [ACK] Seq=1 Ack=2521 Win=32678 ns3::TcpOptionTS(481;426) ns3::TcpOptionEnd(EOL))
r 0.488237 /NodeList/3/$ns3::Ipv4L3Protocol/Rx(1) ns3::Ipv4Header (tos 0x0 DSCP Default ECN Not-ECT ttl 62 id 10 protocol 6 offset (bytes) 0 flags [none] length: 412 10.0.2.1 > 10.0.3.2) ns3::TcpHeader (49153 > 50000 [ACK] Seq=2881 Ack=1 Win=32768 ns3::TcpOptionTS(426;375) ns3::TcpOptionEnd(EOL)) Payload (size=360)
t 0.488237 /NodeList/3/$ns3::Ipv4L3Protocol/Tx(1) ns3::Ipv4Header (tos 0x0 DSCP Default ECN Not-ECT ttl 64 id 5 protocol 6 offset (bytes) 0 flags [none] length: 52 10.0.3.2 > 10.0.2.1) ns3::TcpHeader (50000 > 49153 [ACK] Seq=1 Ack=3241 Win=32678 ns3::TcpOptionTS(488;426) ns3::TcpOptionEnd(EOL))
r 0.488463 /NodeList/1/$ns3::Ipv4L3Protocol/Rx(2) ns3::Ipv4Header (tos 0x0 DSCP Default ECN Not-ECT ttl 64 id 5 protocol 6 offset (bytes) 0 flags [none] length: 52 10.0.3.2 > 10.0.2.1) ns3::TcpHeader (50000 > 49153 [ACK] Seq=1 Ack=3241 Win=32678 ns3::TcpOptionTS(488;426) ns3::TcpOptionEnd(EOL))
t 0.488463 /NodeList/1/$ns3::Ipv4L3Protocol/Tx(1) ns3::Ipv4Header (tos 0x0 DSCP Default ECN Not-ECT ttl 63 id 5 protocol 6 offset (bytes) 0 flags [none] length: 52 10.0.3.2 > 10.0.2.1) ns3::TcpHeader (50000 > 49153 [ACK] Seq=1 Ack=3241 Win=32678 ns3::TcpOptionTS(488;426) ns3::TcpOptionEnd(EOL))
r 0.493895 /NodeList/0/$ns3::Ipv4L3Protocol/Rx(1) ns3::Ipv4Header (tos 0x0 DSCP Default ECN Not-ECT ttl 63 id 5 protocol 6 offset (bytes) 0 flags [none] length: 52 10.0.3.2 > 10.0.2.1) ns3::TcpHeader (50000 > 49153 [ACK] Seq=1 Ack=3241 Win=32678 ns3::TcpOptionTS(488;426) ns3::TcpOptionEnd(EOL))
t 0.493895 /NodeList/0/$ns3::Ipv4L3Protocol/Tx(2) ns3::Ipv4Header (tos 0x0 DSCP Default ECN Not-ECT ttl 62 id 5 protocol 6 offset (bytes) 0 flags [none] length: 52 10.0.3.2 > 10.0.2.1) ns3::TcpHeader (50000 > 49153 [ACK] Seq=1 Ack=3241 Win=32678 ns3::TcpOptionTS(488;426) ns3::TcpOptionEnd(EOL))
r 0.532314 /NodeList/2/$ns3::Ipv4L3Protocol/Rx(1) ns3::Ipv4Header (tos 0x0 DSCP Default ECN Not-ECT ttl 62 id 4 protocol 6 offset (bytes) 0 flags [none] length: 52 10.0.3.2 > 10.0.2.1) ns3::TcpHeader (50000 > 49153 [ACK] Seq=1 Ack=2521 Win=32678 ns3::TcpOptionTS(481;426) ns3::TcpOptionEnd(EOL))
t 0.532314 /NodeList/2/$ns3::Ipv4L3Protocol/Tx(1) ns3::Ipv4Header (tos 0x0 DSCP Default ECN Not-ECT ttl 64 id 11 protocol 6 offset (bytes) 0 flags [none] length: 412 10.0.2.1 > 10.0.3.2) ns3::TcpHeader (49153 > 50000 [ACK] Seq=3241 Ack=1 Win=32768 ns3::TcpOptionTS(532;481) ns3::TcpOptionEnd(EOL)) Payload (size=360)
t 0.532314 /NodeList/2/$ns3::Ipv4L3Protocol/Tx(1) ns3::Ipv4Header (tos 0x0 DSCP Default ECN Not-ECT ttl 64 id 12 protocol 6 offset (bytes) 0 flags [none] length: 412 10.0.2.1 > 10.0.3.2) ns3::TcpHeader (49153 > 50000 [ACK] Seq=3601 Ack=1 Win=32768 ns3::TcpOptionTS(532;481) ns3::TcpOptionEnd(EOL)) Payload (size=360)
t 0.532314 /NodeList/2/$ns3::Ipv4L3Protocol/Tx(1) ns3::Ipv4Header (tos 0x0 DSCP Default ECN Not-ECT ttl 64 id 13 protocol 6 offset (bytes) 0 flags [none] length: 412 10.0.2.1 > 10.0.3.2) ns3::TcpHeader (49153 > 50000 [ACK] Seq=3961 Ack=1 Win=32768 ns3::TcpOptionTS(532;481) ns3::TcpOptionEnd(EOL)) Payload (size=360)
r 0.538938 /NodeList/2/$ns3::Ipv4L3Protocol/Rx(1) ns3::Ipv4Header (tos 0x0 DSCP Default ECN Not-ECT ttl 62 id 5 protocol 6 offset (bytes) 0 flags [none] length: 52 10.0.3.2 > 10.0.2.1) ns3::TcpHeader (50000 > 49153 [ACK] Seq=1 Ack=3241 Win=32678 ns3::TcpOptionTS(488;426) ns3::TcpOptionEnd(EOL))
t 0.538938 /NodeList/2/$ns3::Ipv4L3Protocol/Tx(1) ns3::Ipv4Header (tos 0x0 DSCP Default ECN Not-ECT ttl 64 id 14 protocol 6 offset (bytes) 0 flags [none] length: 412 10.0.2.1 > 10.0.3.2) ns3::TcpHeader (49153 > 50000 [ACK] Seq=4321 Ack=1 Win=32768 ns3::TcpOptionTS(538;488) ns3::TcpOptionEnd(EOL)) Payload (size=360)
t 0.538938 /NodeList/2/$ns3::Ipv4L3Protocol/Tx(1) ns3::Ipv4Header (tos 0x0 DSCP Default ECN Not-ECT ttl 64 id 15 protocol 6 offset (bytes) 0 flags [none] length: 412 10.0.2.1 > 10.0.3.2) ns3::TcpHeader (49153 > 50000 [ACK] Seq=4681 Ack=1 Win=32768 ns3::TcpOptionTS(538;488) ns3::TcpOptionEnd(EOL)) Payload (size=360)
t 0.538938 /NodeList/2/$ns3::Ipv4L3Protocol/Tx(1) ns3::Ipv4Header (tos 0x0 DSCP Default ECN Not-ECT ttl 64 id 16 protocol 6 offset (bytes) 0 flags [none] length: 412 10.0.2.1 > 10.0.3.2) ns3::TcpHeader (49153 > 50000 [ACK] Seq=5041 Ack=1 Win=32768 ns3::TcpOptionTS(538;488) ns3::TcpOptionEnd(EOL)) Payload (size=360)
r 0.577646 /NodeList/0/$ns3::Ipv4L3Protocol/Rx(2) ns3::Ipv4Header (tos 0x0 DSCP Default ECN Not-ECT ttl 64 id 11 protocol 6 offset (bytes) 0 flags [none] length: 412 10.0.2.1 > 10.0.3.2) ns3::TcpHeader (49153 > 50000 [ACK] Seq=3241 Ack=1 Win=32768 ns3::TcpOptionTS(532;481) ns3::TcpOptionEnd(EOL)) Payload (size=360)
t 0.577646 /NodeList/0/$ns3::Ipv4L3Protocol/Tx(1) ns3::Ipv4Header (tos 0x0 DSCP Default ECN Not-ECT ttl 63 id 11 protocol 6 offset (bytes) 0 flags [none] length: 412 10.0.2.1 > 10.0.3.2) ns3::TcpHeader (49153 > 50000 [ACK] Seq=3241 Ack=1 Win=32768 ns3::TcpOptionTS(532;481) ns3::TcpOptionEnd(EOL)) Payload (size=360)
r 0.577977 /NodeList/0/$ns3::Ipv4L3Protocol/Rx(2) ns3::Ipv4Header (tos 0x0 DSCP Default ECN Not-ECT ttl 64 id 12 protocol 6 offset (bytes) 0 flags [none] length: 412 10.0.2.1 > 10.0.3.2) ns3::TcpHeader (49153 > 50000 [ACK] Seq=3601 Ack=1 Win=32768 ns3::TcpOptionTS(532;481) ns3::TcpOptionEnd(EOL)) Payload (size=360)
t 0.577977 /NodeList/0/$ns3::Ipv4L3Protocol/Tx(1) ns3::Ipv4Header (tos 0x0 DSCP Default ECN Not-ECT ttl 63 id 12 protocol 6 offset (bytes) 0 flags [none] length: 412 10.0.2.1 > 10.0.3.2) ns3::TcpHeader (49153 > 50000 [ACK] Seq=3601 Ack=1 Win=32768 ns3::TcpOptionTS(532;481) ns3::TcpOptionEnd(EOL)) Payload (size=360)
r 0.578308 /NodeList/0/$ns3::Ipv4L3Protocol/Rx(2) ns3::Ipv4Header (tos 0x0 DSCP Default ECN Not-ECT ttl 64 id 13 protocol 6 offset (bytes) 0 flags [none] length: 412 10.0.2.1 > 10.0.3.2) ns3::TcpHeader (49153 > 50000 [ACK] Seq=3961 Ack=1 Win=32768 ns3::TcpOptionTS(532;481) ns3::TcpOptionEnd(EOL)) Payload (size=360)
t 0.578308 /NodeList/0/$ns3::Ipv4L3Protocol/Tx(1) ns3::Ipv4Header (tos 0x0 DSCP Default ECN Not-ECT ttl 63 id 13 protocol 6 offset (bytes) 0 flags [none] length: 412 10.0.2.1 > 10.0.3.2) ns3::TcpHeader (49153 > 50000 [ACK] Seq=3961 Ack=1 Win=32768 ns3::TcpOptionTS(532;481) ns3::TcpOptionEnd(EOL)) Payload (size=360)
r 0.58427 /NodeList/0/$ns3::Ipv4L3Protocol/Rx(2) ns3::Ipv4Header (tos 0x0 DSCP Default ECN Not-ECT ttl 64 id 14 protocol 6 offset (bytes) 0 flags [none] length: 412 10.0.2.1 > 10.0.3.2) ns3::TcpHeader (49153 > 50000 [ACK] Seq=4321 Ack=1 Win=32768 ns3::TcpOptionTS(538;488) ns3::TcpOptionEnd(EOL)) Payload (size=360)
t 0.58427 /NodeList/0/$ns3::Ipv4L3Protocol/Tx(1) ns3::Ipv4Header (tos 0x0 DSCP Default ECN Not-ECT ttl 63 id 14 protocol 6 offset (bytes) 0 flags [none] length: 412 10.0.2.1 > 10.0.3.2) ns3::TcpHeader (49153 > 50000 [ACK] Seq=4321 Ack=1 Win=32768 ns3::TcpOptionTS(538;488) ns3::TcpOptionEnd(EOL)) Payload (size=360)
r 0.584601 /NodeList/0/$ns3::Ipv4L3Protocol/Rx(2) ns3::Ipv4Header (tos 0x0 DSCP Default ECN Not-ECT ttl 64 id 15 protocol 6 offset (bytes) 0 flags [none] length: 412 10.0.2.1 > 10.0.3.2) ns3::TcpHeader (49153 > 50000 [ACK] Seq=4681 Ack=1 Win=32768 ns3::TcpOptionTS(538;488) ns3::TcpOptionEnd(EOL)) Payload (size=360)
t 0.584601 /NodeList/0/$ns3::Ipv4L3Protocol/Tx(1) ns3::Ipv4Header (tos 0x0 DSCP Default ECN Not-ECT ttl 63 id 15 protocol 6 offset (bytes) 0 flags [none] length: 412 10.0.2.1 > 10.0.3.2) ns3::TcpHeader (49153 > 50000 [ACK] Seq=4681 Ack=1 Win=32768 ns3::TcpOptionTS(538;488) ns3::TcpOptionEnd(EOL)) Payload (size=360)
r 0.584932 /NodeList/0/$ns3::Ipv4L3Protocol/Rx(2) ns3::Ipv4Header (tos 0x0 DSCP Default ECN Not-ECT ttl 64 id 16 protocol 6 offset (bytes) 0 flags [none] length: 412 10.0.2.1 > 10.0.3.2) ns3::TcpHeader (49153 > 50000 [ACK] Seq=5041 Ack=1 Win=32768 ns3::TcpOptionTS(538;488) ns3::TcpOptionEnd(EOL)) Payload (size=360)
t 0.584932 /NodeList/0/$ns3::Ipv4L3Protocol/Tx(1) ns3::Ipv4Header (tos 0x0 DSCP Default ECN Not-ECT ttl 63 id 16 protocol 6 offset (bytes) 0 flags [none] length: 412 10.0.2.1 > 10.0.3.2) ns3::TcpHeader (49153 > 50000 [ACK] Seq=5041 Ack=1 Win=32768 ns3::TcpOptionTS(538;488) ns3::TcpOptionEnd(EOL)) Payload (size=360)
r 0.585958 /NodeList/1/$ns3::Ipv4L3Protocol/Rx(1) ns3::Ipv4Header (tos 0x0 DSCP Default ECN Not-ECT ttl 63 id 11 protocol 6 offset (bytes) 0 flags [none] length: 412 10.0.2.1 > 10.0.3.2) ns3::TcpHeader (49153 > 50000 [ACK] Seq=3241 Ack=1 Win=32768 ns3::TcpOptionTS(532;481) ns3::TcpOptionEnd(EOL)) Payload (size=360)
t 0.585958 /NodeList/1/$ns3::Ipv4L3Protocol/Tx(2) ns3::Ipv4Header (tos 0x0 DSCP Default ECN Not-ECT ttl 62 id 11 protocol 6 offset (bytes) 0 flags [none] length: 412 10.0.2.1 > 10.0.3.2) ns3::TcpHeader (49153 > 50000 [ACK] Seq=3241 Ack=1 Win=32768 ns3::TcpOptionTS(532;481) ns3::TcpOptionEnd(EOL)) Payload (size=360)
r 0.587624 /NodeList/3/$ns3::Ipv4L3Protocol/Rx(1) ns3::Ipv4Header (tos 0x0 DSCP Default ECN Not-ECT ttl 62 id 11 protocol 6 offset (bytes) 0 flags [none] length: 412 10.0.2.1 > 10.0.3.2) ns3::TcpHeader (49153 > 50000 [ACK] Seq=3241 Ack=1 Win=32768 ns3::TcpOptionTS(532;481) ns3::TcpOptionEnd(EOL)) Payload (size=360)
r 0.58927 /NodeList/1/$ns3::Ipv4L3Protocol/Rx(1) ns3::Ipv4Header (tos 0x0 DSCP Default ECN Not-ECT ttl 63 id 12 protocol 6 offset (bytes) 0 flags [none] length: 412 10.0.2.1 > 10.0.3.2) ns3::TcpHeader (49153 > 50000 [ACK] Seq=3601 Ack=1 Win=32768 ns3::TcpOptionTS(532;481) ns3::TcpOptionEnd(EOL)) Payload (size=360)
t 0.58927 /NodeList/1/$ns3::Ipv4L3Protocol/Tx(2) ns3::Ipv4Header (tos 0x0 DSCP Default ECN Not-ECT ttl 62 id 12 protocol 6 offset (bytes) 0 flags [none] length: 412 10.0.2.1 > 10.0.3.2) ns3::TcpHeader (49153 > 50000 [ACK] Seq=3601 Ack=1 Win=32768 ns3::TcpOptionTS(532;481) ns3::TcpOptionEnd(EOL)) Payload (size=360)
r 0.590936 /NodeList/3/$ns3::Ipv4L3Protocol/Rx(1) ns3::Ipv4Header (tos 0x0 DSCP Default ECN Not-ECT ttl 62 id 12 protocol 6 offset (bytes) 0 flags [none] length: 412 10.0.2.1 > 10.0.3.2) ns3::TcpHeader (49153 > 50000 [ACK] Seq=3601 Ack=1 Win=32768 ns3::TcpOptionTS(532;481) ns3::TcpOptionEnd(EOL)) Payload (size=360)
t 0.590936 /NodeList/3/$ns3::Ipv4L3Protocol/Tx(1) ns3::Ipv4Header (tos 0x0 DSCP Default ECN Not-ECT ttl 64 id 6 protocol 6 offset (bytes) 0 flags [none] length: 52 10.0.3.2 > 10.0.2.1) ns3::TcpHeader (50000 > 49153 [ACK] Seq=1 Ack=3961 Win=32678 ns3::TcpOptionTS(590;532) ns3::TcpOptionEnd(EOL))
r 0.591162 /NodeList/1/$ns3::Ipv4L3Protocol/Rx(2) ns3::Ipv4Header (tos 0x0 DSCP Default ECN Not-ECT ttl 64 id 6 protocol 6 offset (bytes) 0 flags [none] length: 52 10.0.3.2 > 10.0.2.1) ns3::TcpHeader (50000 > 49153 [ACK] Seq=1 Ack=3961 Win=32678 ns3::TcpOptionTS(590;532) ns3::TcpOptionEnd(EOL))
t 0.591162 /NodeList/1/$ns3::Ipv4L3Protocol/Tx(1) ns3::Ipv4Header (tos 0x0 DSCP Default ECN Not-ECT ttl 63 id 6 protocol 6 offset (bytes) 0 flags [none] length: 52 10.0.3.2 > 10.0.2.1) ns3::TcpHeader (50000 > 49153 [ACK] Seq=1 Ack=3961 Win=32678 ns3::TcpOptionTS(590;532) ns3::TcpOptionEnd(EOL))
